{
  "model_family": "v50",
  "release": "v50.1",
  "schema": "v50-complete-store-v1",
  "store_id": "sha256:0000000000000000000000000000000000000000000000000000000000000000",
  "build_id": "0_5_3_3368",
  "producer_identity": "sha256:0000000000000000000000000000000000000000000000000000000000000000",
  "client_build_evidence_id": "sha256:0000000000000000000000000000000000000000000000000000000000000000",
  "index_identity": "sha256:0000000000000000000000000000000000000000000000000000000000000000",
  "row_count": 0,
  "signals": [
    {
      "name": "height_257",
      "dtype": "float32",
      "row_shape": [
        257,
        257
      ],
      "required": true,
      "authoritative_source": "harvest-stream",
      "content_identity": "sha256:0000000000000000000000000000000000000000000000000000000000000000",
      "coverage_count": 0,
      "migration_policy": "copy-if-verified"
    },
    {
      "name": "normal_xyz",
      "dtype": "float32",
      "row_shape": [
        257,
        257,
        3
      ],
      "required": false,
      "authoritative_source": "harvest-stream",
      "content_identity": "sha256:0000000000000000000000000000000000000000000000000000000000000000",
      "coverage_count": 0,
      "migration_policy": "copy-if-verified"
    },
    {
      "name": "normal_mask",
      "dtype": "bool",
      "row_shape": [
        257,
        257
      ],
      "required": false,
      "authoritative_source": "harvest-stream",
      "content_identity": "sha256:0000000000000000000000000000000000000000000000000000000000000000",
      "coverage_count": 0,
      "migration_policy": "copy-if-verified"
    },
    {
      "name": "alpha_256",
      "dtype": "float32",
      "row_shape": [
        256,
        256,
        4
      ],
      "required": false,
      "authoritative_source": "harvest-stream",
      "content_identity": "sha256:0000000000000000000000000000000000000000000000000000000000000000",
      "coverage_count": 0,
      "migration_policy": "copy-if-verified"
    },
    {
      "name": "liquid_mask",
      "dtype": "float32",
      "row_shape": [
        256,
        256
      ],
      "required": false,
      "authoritative_source": "harvest-stream",
      "content_identity": "sha256:0000000000000000000000000000000000000000000000000000000000000000",
      "coverage_count": 0,
      "migration_policy": "fresh-only"
    },
    {
      "name": "liquid_height",
      "dtype": "float32",
      "row_shape": [
        256,
        256
      ],
      "required": false,
      "authoritative_source": "harvest-stream",
      "content_identity": "sha256:0000000000000000000000000000000000000000000000000000000000000000",
      "coverage_count": 0,
      "migration_policy": "fresh-only"
    },
    {
      "name": "liquid_type_256",
      "dtype": "uint8",
      "row_shape": [
        256,
        256
      ],
      "required": false,
      "authoritative_source": "harvest-stream",
      "content_identity": "sha256:0000000000000000000000000000000000000000000000000000000000000000",
      "coverage_count": 0,
      "migration_policy": "copy-if-verified"
    },
    {
      "name": "mcnk_flags_16",
      "dtype": "int32",
      "row_shape": [
        16,
        16
      ],
      "required": false,
      "authoritative_source": "harvest-stream",
      "content_identity": "sha256:0000000000000000000000000000000000000000000000000000000000000000",
      "coverage_count": 0,
      "migration_policy": "copy-if-verified"
    },
    {
      "name": "minimap_rgb",
      "dtype": "uint8",
      "row_shape": [
        256,
        256,
        3
      ],
      "required": true,
      "authoritative_source": "synthetic-minimap",
      "content_identity": "sha256:0000000000000000000000000000000000000000000000000000000000000000",
      "coverage_count": 0,
      "migration_policy": "copy-if-verified"
    },
    {
      "name": "minimap_rgb_1024",
      "dtype": "uint8",
      "row_shape": [
        1024,
        1024,
        3
      ],
      "required": false,
      "authoritative_source": "synthetic-minimap",
      "content_identity": "sha256:0000000000000000000000000000000000000000000000000000000000000000",
      "coverage_count": 0,
      "migration_policy": "copy-if-verified"
    },
    {
      "name": "shadow_mask",
      "dtype": "float32",
      "row_shape": [
        256,
        256
      ],
      "required": false,
      "authoritative_source": "harvest-stream",
      "content_identity": "sha256:0000000000000000000000000000000000000000000000000000000000000000",
      "coverage_count": 0,
      "migration_policy": "copy-if-verified"
    },
    {
      "name": "mcly_texture_ids",
      "dtype": "int32",
      "row_shape": [
        16,
        16,
        4
      ],
      "required": false,
      "authoritative_source": "harvest-stream",
      "content_identity": "sha256:0000000000000000000000000000000000000000000000000000000000000000",
      "coverage_count": 0,
      "migration_policy": "copy-if-verified"
    },
    {
      "name": "mcly_layer_mask",
      "dtype": "float32",
      "row_shape": [
        16,
        16,
        4
      ],
      "required": false,
      "authoritative_source": "harvest-stream",
      "content_identity": "sha256:0000000000000000000000000000000000000000000000000000000000000000",
      "coverage_count": 0,
      "migration_policy": "copy-if-verified"
    },
    {
      "name": "mcnr_mask_257",
      "dtype": "bool",
      "row_shape": [
        257,
        257
      ],
      "required": false,
      "authoritative_source": "harvest-stream",
      "content_identity": "sha256:0000000000000000000000000000000000000000000000000000000000000000",
      "coverage_count": 0,
      "migration_policy": "copy-if-verified"
    },
    {
      "name": "ground_intent_height_257",
      "dtype": "float32",
      "row_shape": [
        257,
        257
      ],
      "required": false,
      "authoritative_source": "harvest-stream",
      "content_identity": "sha256:0000000000000000000000000000000000000000000000000000000000000000",
      "coverage_count": 0,
      "migration_policy": "copy-if-verified"
    },
    {
      "name": "mcly_tileset_ids",
      "dtype": "int32",
      "row_shape": [
        16,
        16,
        4
      ],
      "required": false,
      "authoritative_source": "harvest-stream",
      "content_identity": "sha256:0000000000000000000000000000000000000000000000000000000000000000",
      "coverage_count": 0,
      "migration_policy": "copy-if-verified"
    }
  ],
  "row_lineage_identity": "sha256:0000000000000000000000000000000000000000000000000000000000000000",
  "finalization_state": "incomplete",
  "unavailable_signals": [
    {
      "name": "mccv_rgb",
      "reason": "era_unavailable: MCCV vertex colors introduced WotLK+ (commonly 4.x); absent from pre-3.0 clients (build 0_5_3_3368)"
    }
  ]
}